{
  "schemaVersion": 1,
  "studioId": "studio-4214-sao-bernardo-4e0257",
  "generationId": "gen-721ead953a0df83016cf",
  "inputHash": "721ead953a0df83016cf52fa138874d583f81721eb2d2e35eb9aa6549032f207",
  "provider": "deterministic-source",
  "model": "source-batch-v1",
  "promptVersion": "batch.v1",
  "templateId": "editorial",
  "branding": {
    "colors": {
      "background": "#0b0d0f",
      "surface": "#15191d",
      "primary": "#f3c969",
      "secondary": "#72808d",
      "text": "#f6f2e9",
      "mutedText": "#a8afb5"
    },
    "fontHeading": "Fraunces",
    "fontBody": "Newsreader",
    "radius": "small",
    "mood": [
      "editorial",
      "autoral"
    ],
    "imageTreatment": "Sem mídia não verificada; composição tipográfica e cromática."
  },
  "copy": {
    "hero": {
      "eyebrow": "São Bernardo do Campo — São Paulo",
      "title": "Studio 4214",
      "subtitle": "Um endereço para música em São Bernardo do Campo. Consulte disponibilidade e detalhes diretamente com o estúdio.",
      "primaryCta": "Falar com o estúdio"
    },
    "about": {
      "title": "O estúdio",
      "body": "Studio 4214 é um estúdio musical localizado em São Bernardo do Campo, São Paulo."
    },
    "reviews": {
      "title": "Avaliações",
      "rating": 5,
      "count": 99
    },
    "contact": {
      "title": "Vamos conversar?",
      "body": "Av. Senador Vergueiro, 4214 - Rudge Ramos, São Bernardo do Campo - SP, 09604-000, Brazil",
      "cta": "Chamar no WhatsApp"
    }
  },
  "sections": [
    {
      "id": "hero",
      "enabled": true,
      "order": 0
    },
    {
      "id": "about",
      "enabled": true,
      "order": 1
    },
    {
      "id": "gallery",
      "enabled": false,
      "order": 2
    },
    {
      "id": "equipment",
      "enabled": false,
      "order": 3
    },
    {
      "id": "pricing",
      "enabled": false,
      "order": 4
    },
    {
      "id": "hours",
      "enabled": false,
      "order": 5
    },
    {
      "id": "reviews",
      "enabled": true,
      "order": 6
    },
    {
      "id": "contact",
      "enabled": true,
      "order": 7
    },
    {
      "id": "map",
      "enabled": true,
      "order": 8
    }
  ],
  "assetPaths": [],
  "factualClaims": [
    {
      "path": "copy.hero.eyebrow",
      "evidenceRefs": [
        "facts.map[0]"
      ]
    },
    {
      "path": "copy.hero.subtitle",
      "evidenceRefs": [
        "facts.description[0]"
      ]
    },
    {
      "path": "copy.about.body",
      "evidenceRefs": [
        "facts.description[0]"
      ]
    },
    {
      "path": "copy.reviews",
      "evidenceRefs": [
        "facts.googleReviews[0]"
      ]
    },
    {
      "path": "copy.contact.body",
      "evidenceRefs": [
        "facts.map[0]"
      ]
    }
  ],
  "warnings": [
    "Conteúdo limitado aos dados comerciais confirmados na fonte original."
  ],
  "createdAt": "2026-08-13T04:49:30Z"
}
