{
  "schemaVersion": 1,
  "studioId": "studio-grano-sao-jose-de-58bcc2",
  "generationId": "gen-590df0a50ae069f55709",
  "inputHash": "590df0a50ae069f557096596626eee6f658a5c01d96d245632d5388f63f77aa5",
  "provider": "deterministic-source",
  "model": "source-batch-v1",
  "promptVersion": "batch.v1",
  "templateId": "bold",
  "branding": {
    "colors": {
      "background": "#f2eee7",
      "surface": "#fffaf1",
      "primary": "#bd3f2f",
      "secondary": "#315a63",
      "text": "#211e1b",
      "mutedText": "#6d665e"
    },
    "fontHeading": "Archivo_Black",
    "fontBody": "Outfit",
    "radius": "large",
    "mood": [
      "enérgico",
      "direto"
    ],
    "imageTreatment": "Sem mídia não verificada; composição tipográfica e cromática."
  },
  "copy": {
    "hero": {
      "eyebrow": "São José de Ribamar — Maranhão",
      "title": "Studio Grano",
      "subtitle": "Um endereço para música em São José de Ribamar. Consulte disponibilidade e detalhes diretamente com o estúdio.",
      "primaryCta": "Falar com o estúdio"
    },
    "about": {
      "title": "O estúdio",
      "body": "Studio Grano é um estúdio musical localizado em São José de Ribamar, Maranhão."
    },
    "reviews": {
      "title": "Avaliações",
      "rating": 4.8,
      "count": 45
    },
    "contact": {
      "title": "Vamos conversar?",
      "body": "Av. das Acerolas, Quadra 3, Lote 1 - Cidade Operária, São Luís - MA, 65058-667, Brazil",
      "cta": "Chamar no WhatsApp"
    }
  },
  "sections": [
    {
      "id": "hero",
      "enabled": true,
      "order": 0
    },
    {
      "id": "about",
      "enabled": true,
      "order": 1
    },
    {
      "id": "gallery",
      "enabled": false,
      "order": 2
    },
    {
      "id": "equipment",
      "enabled": false,
      "order": 3
    },
    {
      "id": "pricing",
      "enabled": false,
      "order": 4
    },
    {
      "id": "hours",
      "enabled": false,
      "order": 5
    },
    {
      "id": "reviews",
      "enabled": true,
      "order": 6
    },
    {
      "id": "contact",
      "enabled": true,
      "order": 7
    },
    {
      "id": "map",
      "enabled": true,
      "order": 8
    }
  ],
  "assetPaths": [],
  "factualClaims": [
    {
      "path": "copy.hero.eyebrow",
      "evidenceRefs": [
        "facts.map[0]"
      ]
    },
    {
      "path": "copy.hero.subtitle",
      "evidenceRefs": [
        "facts.description[0]"
      ]
    },
    {
      "path": "copy.about.body",
      "evidenceRefs": [
        "facts.description[0]"
      ]
    },
    {
      "path": "copy.reviews",
      "evidenceRefs": [
        "facts.googleReviews[0]"
      ]
    },
    {
      "path": "copy.contact.body",
      "evidenceRefs": [
        "facts.map[0]"
      ]
    }
  ],
  "warnings": [
    "Conteúdo limitado aos dados comerciais confirmados na fonte original."
  ],
  "createdAt": "2026-08-13T04:49:30Z"
}
