{
  "schemaVersion": 1,
  "studioId": "jetmusic-studio-goiania-798553",
  "generationId": "gen-46a280290349d20e919b",
  "inputHash": "46a280290349d20e919b0e2257abf256001288204e4cfc1bb1ed4addf11a4ef1",
  "provider": "deterministic-source",
  "model": "source-batch-v1",
  "promptVersion": "batch.v1",
  "templateId": "minimal",
  "branding": {
    "colors": {
      "background": "#07130f",
      "surface": "#10241c",
      "primary": "#8fe36c",
      "secondary": "#e3ad59",
      "text": "#f1f5e9",
      "mutedText": "#9eb2a7"
    },
    "fontHeading": "Literata",
    "fontBody": "Source_Sans_3",
    "radius": "medium",
    "mood": [
      "preciso",
      "calmo"
    ],
    "imageTreatment": "Sem mídia não verificada; composição tipográfica e cromática."
  },
  "copy": {
    "hero": {
      "eyebrow": "Goiânia — Goiás",
      "title": "JETMusic Studio",
      "subtitle": "Um endereço para música em Goiânia. Consulte disponibilidade e detalhes diretamente com o estúdio.",
      "primaryCta": "Falar com o estúdio"
    },
    "about": {
      "title": "O estúdio",
      "body": "JETMusic Studio é um estúdio musical localizado em Goiânia, Goiás."
    },
    "reviews": {
      "title": "Avaliações",
      "rating": 4.9,
      "count": 80
    },
    "contact": {
      "title": "Vamos conversar?",
      "body": "R. 25 de Dezembro, 725 - quadra 12 lote 32 - Jardim Gramado, Goiânia - GO, 74585-725, Brazil",
      "cta": "Chamar no WhatsApp"
    }
  },
  "sections": [
    {
      "id": "hero",
      "enabled": true,
      "order": 0
    },
    {
      "id": "about",
      "enabled": true,
      "order": 1
    },
    {
      "id": "gallery",
      "enabled": false,
      "order": 2
    },
    {
      "id": "equipment",
      "enabled": false,
      "order": 3
    },
    {
      "id": "pricing",
      "enabled": false,
      "order": 4
    },
    {
      "id": "hours",
      "enabled": false,
      "order": 5
    },
    {
      "id": "reviews",
      "enabled": true,
      "order": 6
    },
    {
      "id": "contact",
      "enabled": true,
      "order": 7
    },
    {
      "id": "map",
      "enabled": true,
      "order": 8
    }
  ],
  "assetPaths": [],
  "factualClaims": [
    {
      "path": "copy.hero.eyebrow",
      "evidenceRefs": [
        "facts.map[0]"
      ]
    },
    {
      "path": "copy.hero.subtitle",
      "evidenceRefs": [
        "facts.description[0]"
      ]
    },
    {
      "path": "copy.about.body",
      "evidenceRefs": [
        "facts.description[0]"
      ]
    },
    {
      "path": "copy.reviews",
      "evidenceRefs": [
        "facts.googleReviews[0]"
      ]
    },
    {
      "path": "copy.contact.body",
      "evidenceRefs": [
        "facts.map[0]"
      ]
    }
  ],
  "warnings": [
    "Conteúdo limitado aos dados comerciais confirmados na fonte original."
  ],
  "createdAt": "2026-08-13T04:49:30Z"
}
