{
  "schemaVersion": 1,
  "studioId": "container-estudio-taubate-55f6d7",
  "generationId": "gen-6a97e28b4b687999f68f",
  "inputHash": "6a97e28b4b687999f68fdfa058447e8dd84ded67d09e14b05b7ccf1b6a6ae40f",
  "provider": "deterministic-source",
  "model": "source-batch-v1",
  "promptVersion": "batch.v1",
  "templateId": "immersive",
  "branding": {
    "colors": {
      "background": "#f2eee7",
      "surface": "#fffaf1",
      "primary": "#bd3f2f",
      "secondary": "#315a63",
      "text": "#211e1b",
      "mutedText": "#6d665e"
    },
    "fontHeading": "Bebas_Neue",
    "fontBody": "IBM_Plex_Sans",
    "radius": "none",
    "mood": [
      "imersivo",
      "noturno"
    ],
    "imageTreatment": "Sem mídia não verificada; composição tipográfica e cromática."
  },
  "copy": {
    "hero": {
      "eyebrow": "Taubaté — São Paulo",
      "title": "Container Estúdio",
      "subtitle": "Um endereço para música em Taubaté. Consulte disponibilidade e detalhes diretamente com o estúdio.",
      "primaryCta": "Falar com o estúdio"
    },
    "about": {
      "title": "O estúdio",
      "body": "Container Estúdio é um estúdio musical localizado em Taubaté, São Paulo."
    },
    "reviews": {
      "title": "Avaliações",
      "rating": 4.9,
      "count": 48
    },
    "contact": {
      "title": "Vamos conversar?",
      "body": "R. Dona Benta, 1194 - Jardim Gurilândia, Taubaté - SP, 12071-580, Brazil",
      "cta": "Chamar no WhatsApp"
    }
  },
  "sections": [
    {
      "id": "hero",
      "enabled": true,
      "order": 0
    },
    {
      "id": "about",
      "enabled": true,
      "order": 1
    },
    {
      "id": "gallery",
      "enabled": false,
      "order": 2
    },
    {
      "id": "equipment",
      "enabled": false,
      "order": 3
    },
    {
      "id": "pricing",
      "enabled": false,
      "order": 4
    },
    {
      "id": "hours",
      "enabled": false,
      "order": 5
    },
    {
      "id": "reviews",
      "enabled": true,
      "order": 6
    },
    {
      "id": "contact",
      "enabled": true,
      "order": 7
    },
    {
      "id": "map",
      "enabled": true,
      "order": 8
    }
  ],
  "assetPaths": [],
  "factualClaims": [
    {
      "path": "copy.hero.eyebrow",
      "evidenceRefs": [
        "facts.map[0]"
      ]
    },
    {
      "path": "copy.hero.subtitle",
      "evidenceRefs": [
        "facts.description[0]"
      ]
    },
    {
      "path": "copy.about.body",
      "evidenceRefs": [
        "facts.description[0]"
      ]
    },
    {
      "path": "copy.reviews",
      "evidenceRefs": [
        "facts.googleReviews[0]"
      ]
    },
    {
      "path": "copy.contact.body",
      "evidenceRefs": [
        "facts.map[0]"
      ]
    }
  ],
  "warnings": [
    "Conteúdo limitado aos dados comerciais confirmados na fonte original."
  ],
  "createdAt": "2026-08-13T04:49:30Z"
}
