{
  "schemaVersion": 1,
  "studioId": "estudio-do-rio-vermelho-biguacu-5d041b",
  "generationId": "gen-cdf99f7b582d0356ac3f",
  "inputHash": "cdf99f7b582d0356ac3f01a0e2fab2e6c43babf0b074bc2f6ca8949070953458",
  "provider": "deterministic-source",
  "model": "source-batch-v1",
  "promptVersion": "batch.v1",
  "templateId": "immersive",
  "branding": {
    "colors": {
      "background": "#f2eee7",
      "surface": "#fffaf1",
      "primary": "#bd3f2f",
      "secondary": "#315a63",
      "text": "#211e1b",
      "mutedText": "#6d665e"
    },
    "fontHeading": "Bebas_Neue",
    "fontBody": "IBM_Plex_Sans",
    "radius": "none",
    "mood": [
      "imersivo",
      "noturno"
    ],
    "imageTreatment": "Sem mídia não verificada; composição tipográfica e cromática."
  },
  "copy": {
    "hero": {
      "eyebrow": "Biguaçu — Santa Catarina",
      "title": "Estúdio do Rio Vermelho",
      "subtitle": "Um endereço para música em Biguaçu. Consulte disponibilidade e detalhes diretamente com o estúdio.",
      "primaryCta": "Falar com o estúdio"
    },
    "about": {
      "title": "O estúdio",
      "body": "Estúdio do Rio Vermelho é um estúdio musical localizado em Biguaçu, Santa Catarina."
    },
    "reviews": {
      "title": "Avaliações",
      "rating": 4.6,
      "count": 38
    },
    "contact": {
      "title": "Vamos conversar?",
      "body": "R. Antenor de Souza Conceição, 740 - São João do Rio Vermelho, Florianópolis - SC, 88060-220, Brazil",
      "cta": "Chamar no WhatsApp"
    }
  },
  "sections": [
    {
      "id": "hero",
      "enabled": true,
      "order": 0
    },
    {
      "id": "about",
      "enabled": true,
      "order": 1
    },
    {
      "id": "gallery",
      "enabled": false,
      "order": 2
    },
    {
      "id": "equipment",
      "enabled": false,
      "order": 3
    },
    {
      "id": "pricing",
      "enabled": false,
      "order": 4
    },
    {
      "id": "hours",
      "enabled": false,
      "order": 5
    },
    {
      "id": "reviews",
      "enabled": true,
      "order": 6
    },
    {
      "id": "contact",
      "enabled": true,
      "order": 7
    },
    {
      "id": "map",
      "enabled": true,
      "order": 8
    }
  ],
  "assetPaths": [],
  "factualClaims": [
    {
      "path": "copy.hero.eyebrow",
      "evidenceRefs": [
        "facts.map[0]"
      ]
    },
    {
      "path": "copy.hero.subtitle",
      "evidenceRefs": [
        "facts.description[0]"
      ]
    },
    {
      "path": "copy.about.body",
      "evidenceRefs": [
        "facts.description[0]"
      ]
    },
    {
      "path": "copy.reviews",
      "evidenceRefs": [
        "facts.googleReviews[0]"
      ]
    },
    {
      "path": "copy.contact.body",
      "evidenceRefs": [
        "facts.map[0]"
      ]
    }
  ],
  "warnings": [
    "Conteúdo limitado aos dados comerciais confirmados na fonte original."
  ],
  "createdAt": "2026-08-13T04:49:30Z"
}
