{
  "schemaVersion": 1,
  "studioId": "estudio-akira-criciuma-5d78fa",
  "generationId": "gen-5824b7b344f416f536f0",
  "inputHash": "5824b7b344f416f536f069483ae640b8bef1450abbf821efa95f9019a7ffcfb2",
  "provider": "deterministic-source",
  "model": "source-batch-v1",
  "promptVersion": "batch.v1",
  "templateId": "bold",
  "branding": {
    "colors": {
      "background": "#08080a",
      "surface": "#18181d",
      "primary": "#d7ff3f",
      "secondary": "#9a8cff",
      "text": "#f8f8f2",
      "mutedText": "#a4a4ad"
    },
    "fontHeading": "Archivo_Black",
    "fontBody": "Outfit",
    "radius": "large",
    "mood": [
      "enérgico",
      "direto"
    ],
    "imageTreatment": "Sem mídia não verificada; composição tipográfica e cromática."
  },
  "copy": {
    "hero": {
      "eyebrow": "Criciúma — Santa Catarina",
      "title": "Estúdio Akira",
      "subtitle": "Um endereço para música em Criciúma. Consulte disponibilidade e detalhes diretamente com o estúdio.",
      "primaryCta": "Falar com o estúdio"
    },
    "about": {
      "title": "O estúdio",
      "body": "Estúdio Akira é um estúdio musical localizado em Criciúma, Santa Catarina."
    },
    "reviews": {
      "title": "Avaliações",
      "rating": 5,
      "count": 69
    },
    "contact": {
      "title": "Vamos conversar?",
      "body": "R. Niterói - Brasília, Criciúma - SC, 88813-175, Brazil",
      "cta": "Chamar no WhatsApp"
    }
  },
  "sections": [
    {
      "id": "hero",
      "enabled": true,
      "order": 0
    },
    {
      "id": "about",
      "enabled": true,
      "order": 1
    },
    {
      "id": "gallery",
      "enabled": false,
      "order": 2
    },
    {
      "id": "equipment",
      "enabled": false,
      "order": 3
    },
    {
      "id": "pricing",
      "enabled": false,
      "order": 4
    },
    {
      "id": "hours",
      "enabled": false,
      "order": 5
    },
    {
      "id": "reviews",
      "enabled": true,
      "order": 6
    },
    {
      "id": "contact",
      "enabled": true,
      "order": 7
    },
    {
      "id": "map",
      "enabled": true,
      "order": 8
    }
  ],
  "assetPaths": [],
  "factualClaims": [
    {
      "path": "copy.hero.eyebrow",
      "evidenceRefs": [
        "facts.map[0]"
      ]
    },
    {
      "path": "copy.hero.subtitle",
      "evidenceRefs": [
        "facts.description[0]"
      ]
    },
    {
      "path": "copy.about.body",
      "evidenceRefs": [
        "facts.description[0]"
      ]
    },
    {
      "path": "copy.reviews",
      "evidenceRefs": [
        "facts.googleReviews[0]"
      ]
    },
    {
      "path": "copy.contact.body",
      "evidenceRefs": [
        "facts.map[0]"
      ]
    }
  ],
  "warnings": [
    "Conteúdo limitado aos dados comerciais confirmados na fonte original."
  ],
  "createdAt": "2026-08-13T04:49:30Z"
}
