{
  "schemaVersion": 1,
  "studioId": "panda-studio-muriae-mg-muriae-124250",
  "generationId": "gen-4c3d61b727b97f0d5755",
  "inputHash": "4c3d61b727b97f0d575521bb0d95a0aef763d6989eb3ce447223663afd7e0fb4",
  "provider": "deterministic-source",
  "model": "source-batch-v1",
  "promptVersion": "batch.v1",
  "templateId": "immersive",
  "branding": {
    "colors": {
      "background": "#f2eee7",
      "surface": "#fffaf1",
      "primary": "#bd3f2f",
      "secondary": "#315a63",
      "text": "#211e1b",
      "mutedText": "#6d665e"
    },
    "fontHeading": "Bebas_Neue",
    "fontBody": "IBM_Plex_Sans",
    "radius": "none",
    "mood": [
      "imersivo",
      "noturno"
    ],
    "imageTreatment": "Sem mídia não verificada; composição tipográfica e cromática."
  },
  "copy": {
    "hero": {
      "eyebrow": "Muriaé — Minas Gerais",
      "title": "Panda Studio - Muriaé-MG",
      "subtitle": "Um endereço para música em Muriaé. Consulte disponibilidade e detalhes diretamente com o estúdio.",
      "primaryCta": "Falar com o estúdio"
    },
    "about": {
      "title": "O estúdio",
      "body": "Panda Studio - Muriaé-MG é um estúdio musical localizado em Muriaé, Minas Gerais."
    },
    "reviews": {
      "title": "Avaliações",
      "rating": 5,
      "count": 25
    },
    "contact": {
      "title": "Vamos conversar?",
      "body": "R. João XXIII, 53 - Edgar Miranda, Muriaé - MG, 36889-368, Brazil",
      "cta": "Chamar no WhatsApp"
    }
  },
  "sections": [
    {
      "id": "hero",
      "enabled": true,
      "order": 0
    },
    {
      "id": "about",
      "enabled": true,
      "order": 1
    },
    {
      "id": "gallery",
      "enabled": false,
      "order": 2
    },
    {
      "id": "equipment",
      "enabled": false,
      "order": 3
    },
    {
      "id": "pricing",
      "enabled": false,
      "order": 4
    },
    {
      "id": "hours",
      "enabled": false,
      "order": 5
    },
    {
      "id": "reviews",
      "enabled": true,
      "order": 6
    },
    {
      "id": "contact",
      "enabled": true,
      "order": 7
    },
    {
      "id": "map",
      "enabled": true,
      "order": 8
    }
  ],
  "assetPaths": [],
  "factualClaims": [
    {
      "path": "copy.hero.eyebrow",
      "evidenceRefs": [
        "facts.map[0]"
      ]
    },
    {
      "path": "copy.hero.subtitle",
      "evidenceRefs": [
        "facts.description[0]"
      ]
    },
    {
      "path": "copy.about.body",
      "evidenceRefs": [
        "facts.description[0]"
      ]
    },
    {
      "path": "copy.reviews",
      "evidenceRefs": [
        "facts.googleReviews[0]"
      ]
    },
    {
      "path": "copy.contact.body",
      "evidenceRefs": [
        "facts.map[0]"
      ]
    }
  ],
  "warnings": [
    "Conteúdo limitado aos dados comerciais confirmados na fonte original."
  ],
  "createdAt": "2026-08-13T04:49:30Z"
}
