{
  "schemaVersion": 1,
  "studioId": "estudio-da-15-aguas-lindas-fe3a3b",
  "generationId": "gen-bacb1cf2c3d8df54541d",
  "inputHash": "bacb1cf2c3d8df54541d40b0090886c6b01e1dadc3b484927134361e992cc776",
  "provider": "deterministic-source",
  "model": "source-batch-v1",
  "promptVersion": "batch.v1",
  "templateId": "editorial",
  "branding": {
    "colors": {
      "background": "#efe6d3",
      "surface": "#faf3e6",
      "primary": "#213a5c",
      "secondary": "#a04e36",
      "text": "#17202a",
      "mutedText": "#6d6b68"
    },
    "fontHeading": "Fraunces",
    "fontBody": "Newsreader",
    "radius": "small",
    "mood": [
      "editorial",
      "autoral"
    ],
    "imageTreatment": "Sem mídia não verificada; composição tipográfica e cromática."
  },
  "copy": {
    "hero": {
      "eyebrow": "Águas Lindas de Goiás — Goiás",
      "title": "Estúdio da 15",
      "subtitle": "Um endereço para música em Águas Lindas de Goiás. Consulte disponibilidade e detalhes diretamente com o estúdio.",
      "primaryCta": "Falar com o estúdio"
    },
    "about": {
      "title": "O estúdio",
      "body": "Estúdio da 15 é um estúdio musical localizado em Águas Lindas de Goiás, Goiás."
    },
    "reviews": {
      "title": "Avaliações",
      "rating": 4.9,
      "count": 33
    },
    "contact": {
      "title": "Vamos conversar?",
      "body": "Asa Norte Comércio Local Norte 115 bl a loja 31s - Asa Norte, Brasília - DF, 70297-400, Brazil",
      "cta": "Chamar no WhatsApp"
    }
  },
  "sections": [
    {
      "id": "hero",
      "enabled": true,
      "order": 0
    },
    {
      "id": "about",
      "enabled": true,
      "order": 1
    },
    {
      "id": "gallery",
      "enabled": false,
      "order": 2
    },
    {
      "id": "equipment",
      "enabled": false,
      "order": 3
    },
    {
      "id": "pricing",
      "enabled": false,
      "order": 4
    },
    {
      "id": "hours",
      "enabled": false,
      "order": 5
    },
    {
      "id": "reviews",
      "enabled": true,
      "order": 6
    },
    {
      "id": "contact",
      "enabled": true,
      "order": 7
    },
    {
      "id": "map",
      "enabled": true,
      "order": 8
    }
  ],
  "assetPaths": [],
  "factualClaims": [
    {
      "path": "copy.hero.eyebrow",
      "evidenceRefs": [
        "facts.map[0]"
      ]
    },
    {
      "path": "copy.hero.subtitle",
      "evidenceRefs": [
        "facts.description[0]"
      ]
    },
    {
      "path": "copy.about.body",
      "evidenceRefs": [
        "facts.description[0]"
      ]
    },
    {
      "path": "copy.reviews",
      "evidenceRefs": [
        "facts.googleReviews[0]"
      ]
    },
    {
      "path": "copy.contact.body",
      "evidenceRefs": [
        "facts.map[0]"
      ]
    }
  ],
  "warnings": [
    "Conteúdo limitado aos dados comerciais confirmados na fonte original."
  ],
  "createdAt": "2026-08-13T04:49:30Z"
}
