{
  "schemaVersion": 1,
  "studioId": "eds-producoes-juazeiro-do-b19a6c",
  "generationId": "gen-e404d7f737fdc97c4d37",
  "inputHash": "e404d7f737fdc97c4d37611f72e7412eb61be0cbe784fac3695861834709b96b",
  "provider": "deterministic-source",
  "model": "source-batch-v1",
  "promptVersion": "batch.v1",
  "templateId": "bold",
  "branding": {
    "colors": {
      "background": "#f2eee7",
      "surface": "#fffaf1",
      "primary": "#bd3f2f",
      "secondary": "#315a63",
      "text": "#211e1b",
      "mutedText": "#6d665e"
    },
    "fontHeading": "Archivo_Black",
    "fontBody": "Outfit",
    "radius": "large",
    "mood": [
      "enérgico",
      "direto"
    ],
    "imageTreatment": "Sem mídia não verificada; composição tipográfica e cromática."
  },
  "copy": {
    "hero": {
      "eyebrow": "Juazeiro do Norte — Ceará",
      "title": "EDS Produções",
      "subtitle": "Um endereço para música em Juazeiro do Norte. Consulte disponibilidade e detalhes diretamente com o estúdio.",
      "primaryCta": "Falar com o estúdio"
    },
    "about": {
      "title": "O estúdio",
      "body": "EDS Produções é um estúdio musical localizado em Juazeiro do Norte, Ceará."
    },
    "reviews": {
      "title": "Avaliações",
      "rating": 4.9,
      "count": 30
    },
    "contact": {
      "title": "Vamos conversar?",
      "body": "R. Ana Pereira da Silva, 904 - Betolândia, Juazeiro do Norte - CE, 63036-060, Brazil",
      "cta": "Chamar no WhatsApp"
    }
  },
  "sections": [
    {
      "id": "hero",
      "enabled": true,
      "order": 0
    },
    {
      "id": "about",
      "enabled": true,
      "order": 1
    },
    {
      "id": "gallery",
      "enabled": false,
      "order": 2
    },
    {
      "id": "equipment",
      "enabled": false,
      "order": 3
    },
    {
      "id": "pricing",
      "enabled": false,
      "order": 4
    },
    {
      "id": "hours",
      "enabled": false,
      "order": 5
    },
    {
      "id": "reviews",
      "enabled": true,
      "order": 6
    },
    {
      "id": "contact",
      "enabled": true,
      "order": 7
    },
    {
      "id": "map",
      "enabled": true,
      "order": 8
    }
  ],
  "assetPaths": [],
  "factualClaims": [
    {
      "path": "copy.hero.eyebrow",
      "evidenceRefs": [
        "facts.map[0]"
      ]
    },
    {
      "path": "copy.hero.subtitle",
      "evidenceRefs": [
        "facts.description[0]"
      ]
    },
    {
      "path": "copy.about.body",
      "evidenceRefs": [
        "facts.description[0]"
      ]
    },
    {
      "path": "copy.reviews",
      "evidenceRefs": [
        "facts.googleReviews[0]"
      ]
    },
    {
      "path": "copy.contact.body",
      "evidenceRefs": [
        "facts.map[0]"
      ]
    }
  ],
  "warnings": [
    "Conteúdo limitado aos dados comerciais confirmados na fonte original."
  ],
  "createdAt": "2026-08-13T04:49:30Z"
}
