{
  "schemaVersion": 1,
  "studioId": "tulio-estudio-ensaio-divinopolis-c33880",
  "generationId": "gen-94895f8a4f14f0e37b5a",
  "inputHash": "94895f8a4f14f0e37b5ab610277546796349db609037e8e084377a17e1a1cfd5",
  "provider": "deterministic-source",
  "model": "source-batch-v1",
  "promptVersion": "batch.v1",
  "templateId": "editorial",
  "branding": {
    "colors": {
      "background": "#0b0d0f",
      "surface": "#15191d",
      "primary": "#f3c969",
      "secondary": "#72808d",
      "text": "#f6f2e9",
      "mutedText": "#a8afb5"
    },
    "fontHeading": "Fraunces",
    "fontBody": "Newsreader",
    "radius": "small",
    "mood": [
      "editorial",
      "autoral"
    ],
    "imageTreatment": "Sem mídia não verificada; composição tipográfica e cromática."
  },
  "copy": {
    "hero": {
      "eyebrow": "Divinópolis — Minas Gerais",
      "title": "Tulio Estudio Ensaio",
      "subtitle": "Um endereço para música em Divinópolis. Consulte disponibilidade e detalhes diretamente com o estúdio.",
      "primaryCta": "Falar com o estúdio"
    },
    "about": {
      "title": "O estúdio",
      "body": "Tulio Estudio Ensaio é um estúdio musical localizado em Divinópolis, Minas Gerais."
    },
    "reviews": {
      "title": "Avaliações",
      "rating": 4.7,
      "count": 37
    },
    "contact": {
      "title": "Vamos conversar?",
      "body": "R. Araxá, 560 - Res. Morro do Sol, Itaúna - MG, 35680-284, Brazil",
      "cta": "Chamar no WhatsApp"
    }
  },
  "sections": [
    {
      "id": "hero",
      "enabled": true,
      "order": 0
    },
    {
      "id": "about",
      "enabled": true,
      "order": 1
    },
    {
      "id": "gallery",
      "enabled": false,
      "order": 2
    },
    {
      "id": "equipment",
      "enabled": false,
      "order": 3
    },
    {
      "id": "pricing",
      "enabled": false,
      "order": 4
    },
    {
      "id": "hours",
      "enabled": false,
      "order": 5
    },
    {
      "id": "reviews",
      "enabled": true,
      "order": 6
    },
    {
      "id": "contact",
      "enabled": true,
      "order": 7
    },
    {
      "id": "map",
      "enabled": true,
      "order": 8
    }
  ],
  "assetPaths": [],
  "factualClaims": [
    {
      "path": "copy.hero.eyebrow",
      "evidenceRefs": [
        "facts.map[0]"
      ]
    },
    {
      "path": "copy.hero.subtitle",
      "evidenceRefs": [
        "facts.description[0]"
      ]
    },
    {
      "path": "copy.about.body",
      "evidenceRefs": [
        "facts.description[0]"
      ]
    },
    {
      "path": "copy.reviews",
      "evidenceRefs": [
        "facts.googleReviews[0]"
      ]
    },
    {
      "path": "copy.contact.body",
      "evidenceRefs": [
        "facts.map[0]"
      ]
    }
  ],
  "warnings": [
    "Conteúdo limitado aos dados comerciais confirmados na fonte original."
  ],
  "createdAt": "2026-08-13T04:49:30Z"
}
