{
  "schemaVersion": 1,
  "studioId": "green-view-studio-sao-carlos-6dd9b4",
  "generationId": "gen-e1ab6e8592d6175720aa",
  "inputHash": "e1ab6e8592d6175720aa1611ed5e5cd626967db185ba6f42ac9e4603eaa96ed3",
  "provider": "deterministic-source",
  "model": "source-batch-v1",
  "promptVersion": "batch.v1",
  "templateId": "bold",
  "branding": {
    "colors": {
      "background": "#111018",
      "surface": "#201b2b",
      "primary": "#ff6b4a",
      "secondary": "#6fd0ca",
      "text": "#fff6ea",
      "mutedText": "#b9acbd"
    },
    "fontHeading": "Archivo_Black",
    "fontBody": "Outfit",
    "radius": "large",
    "mood": [
      "enérgico",
      "direto"
    ],
    "imageTreatment": "Sem mídia não verificada; composição tipográfica e cromática."
  },
  "copy": {
    "hero": {
      "eyebrow": "São Carlos — São Paulo",
      "title": "Green View Studio",
      "subtitle": "Um endereço para música em São Carlos. Consulte disponibilidade e detalhes diretamente com o estúdio.",
      "primaryCta": "Falar com o estúdio"
    },
    "about": {
      "title": "O estúdio",
      "body": "Green View Studio é um estúdio musical localizado em São Carlos, São Paulo."
    },
    "reviews": {
      "title": "Avaliações",
      "rating": 5,
      "count": 36
    },
    "contact": {
      "title": "Vamos conversar?",
      "body": "R. Sebastião Sampaio Osório, 999 - Parque Paraiso, São Carlos - SP, 13562-120, Brazil",
      "cta": "Chamar no WhatsApp"
    }
  },
  "sections": [
    {
      "id": "hero",
      "enabled": true,
      "order": 0
    },
    {
      "id": "about",
      "enabled": true,
      "order": 1
    },
    {
      "id": "gallery",
      "enabled": false,
      "order": 2
    },
    {
      "id": "equipment",
      "enabled": false,
      "order": 3
    },
    {
      "id": "pricing",
      "enabled": false,
      "order": 4
    },
    {
      "id": "hours",
      "enabled": false,
      "order": 5
    },
    {
      "id": "reviews",
      "enabled": true,
      "order": 6
    },
    {
      "id": "contact",
      "enabled": true,
      "order": 7
    },
    {
      "id": "map",
      "enabled": true,
      "order": 8
    }
  ],
  "assetPaths": [],
  "factualClaims": [
    {
      "path": "copy.hero.eyebrow",
      "evidenceRefs": [
        "facts.map[0]"
      ]
    },
    {
      "path": "copy.hero.subtitle",
      "evidenceRefs": [
        "facts.description[0]"
      ]
    },
    {
      "path": "copy.about.body",
      "evidenceRefs": [
        "facts.description[0]"
      ]
    },
    {
      "path": "copy.reviews",
      "evidenceRefs": [
        "facts.googleReviews[0]"
      ]
    },
    {
      "path": "copy.contact.body",
      "evidenceRefs": [
        "facts.map[0]"
      ]
    }
  ],
  "warnings": [
    "Conteúdo limitado aos dados comerciais confirmados na fonte original."
  ],
  "createdAt": "2026-08-13T04:49:30Z"
}
