{
  "schemaVersion": 1,
  "studioId": "dom-faro-records-estudio-de-gravacao-uberlandia-e18ef7",
  "generationId": "gen-52f1635369f516f1f8a1",
  "inputHash": "52f1635369f516f1f8a19223d1db1f3c9b19b1589dd9d9c5933917883fb6d815",
  "provider": "deterministic-source",
  "model": "source-batch-v1",
  "promptVersion": "batch.v1",
  "templateId": "minimal",
  "branding": {
    "colors": {
      "background": "#0b0d0f",
      "surface": "#15191d",
      "primary": "#f3c969",
      "secondary": "#72808d",
      "text": "#f6f2e9",
      "mutedText": "#a8afb5"
    },
    "fontHeading": "Literata",
    "fontBody": "Source_Sans_3",
    "radius": "medium",
    "mood": [
      "preciso",
      "calmo"
    ],
    "imageTreatment": "Sem mídia não verificada; composição tipográfica e cromática."
  },
  "copy": {
    "hero": {
      "eyebrow": "Uberlândia — Minas Gerais",
      "title": "Dom Faro Records - Estúdio de Gravação",
      "subtitle": "Um endereço para música em Uberlândia. Consulte disponibilidade e detalhes diretamente com o estúdio.",
      "primaryCta": "Falar com o estúdio"
    },
    "about": {
      "title": "O estúdio",
      "body": "Dom Faro Records - Estúdio de Gravação é um estúdio musical localizado em Uberlândia, Minas Gerais."
    },
    "reviews": {
      "title": "Avaliações",
      "rating": 5,
      "count": 43
    },
    "contact": {
      "title": "Vamos conversar?",
      "body": "Av. Solidariedade - Morumbi, Uberlândia - MG, 38407-226, Brazil",
      "cta": "Chamar no WhatsApp"
    }
  },
  "sections": [
    {
      "id": "hero",
      "enabled": true,
      "order": 0
    },
    {
      "id": "about",
      "enabled": true,
      "order": 1
    },
    {
      "id": "gallery",
      "enabled": false,
      "order": 2
    },
    {
      "id": "equipment",
      "enabled": false,
      "order": 3
    },
    {
      "id": "pricing",
      "enabled": false,
      "order": 4
    },
    {
      "id": "hours",
      "enabled": false,
      "order": 5
    },
    {
      "id": "reviews",
      "enabled": true,
      "order": 6
    },
    {
      "id": "contact",
      "enabled": true,
      "order": 7
    },
    {
      "id": "map",
      "enabled": true,
      "order": 8
    }
  ],
  "assetPaths": [],
  "factualClaims": [
    {
      "path": "copy.hero.eyebrow",
      "evidenceRefs": [
        "facts.map[0]"
      ]
    },
    {
      "path": "copy.hero.subtitle",
      "evidenceRefs": [
        "facts.description[0]"
      ]
    },
    {
      "path": "copy.about.body",
      "evidenceRefs": [
        "facts.description[0]"
      ]
    },
    {
      "path": "copy.reviews",
      "evidenceRefs": [
        "facts.googleReviews[0]"
      ]
    },
    {
      "path": "copy.contact.body",
      "evidenceRefs": [
        "facts.map[0]"
      ]
    }
  ],
  "warnings": [
    "Conteúdo limitado aos dados comerciais confirmados na fonte original."
  ],
  "createdAt": "2026-08-13T04:49:30Z"
}
