{
  "schemaVersion": 1,
  "studioId": "horus-estudio-de-fotografia-e-video-caucaia-4d60b1",
  "generationId": "gen-9ab457f64d17fb2ae75e",
  "inputHash": "9ab457f64d17fb2ae75eb2429cf48e8cb918cdc810e53b57f7fe24b3c3c89824",
  "provider": "deterministic-source",
  "model": "source-batch-v1",
  "promptVersion": "batch.v1",
  "templateId": "immersive",
  "branding": {
    "colors": {
      "background": "#111018",
      "surface": "#201b2b",
      "primary": "#ff6b4a",
      "secondary": "#6fd0ca",
      "text": "#fff6ea",
      "mutedText": "#b9acbd"
    },
    "fontHeading": "Bebas_Neue",
    "fontBody": "IBM_Plex_Sans",
    "radius": "none",
    "mood": [
      "imersivo",
      "noturno"
    ],
    "imageTreatment": "Sem mídia não verificada; composição tipográfica e cromática."
  },
  "copy": {
    "hero": {
      "eyebrow": "Caucaia — Ceará",
      "title": "Hórus Estúdio de fotografia e vídeo",
      "subtitle": "Um endereço para música em Caucaia. Consulte disponibilidade e detalhes diretamente com o estúdio.",
      "primaryCta": "Falar com o estúdio"
    },
    "about": {
      "title": "O estúdio",
      "body": "Hórus Estúdio de fotografia e vídeo é um estúdio musical localizado em Caucaia, Ceará."
    },
    "reviews": {
      "title": "Avaliações",
      "rating": 5,
      "count": 42
    },
    "contact": {
      "title": "Vamos conversar?",
      "body": "R. Jorge Dumar, 2121 - Sala 105 - Montese, Fortaleza - CE, 60410-426, Brazil",
      "cta": "Chamar no WhatsApp"
    }
  },
  "sections": [
    {
      "id": "hero",
      "enabled": true,
      "order": 0
    },
    {
      "id": "about",
      "enabled": true,
      "order": 1
    },
    {
      "id": "gallery",
      "enabled": false,
      "order": 2
    },
    {
      "id": "equipment",
      "enabled": false,
      "order": 3
    },
    {
      "id": "pricing",
      "enabled": false,
      "order": 4
    },
    {
      "id": "hours",
      "enabled": false,
      "order": 5
    },
    {
      "id": "reviews",
      "enabled": true,
      "order": 6
    },
    {
      "id": "contact",
      "enabled": true,
      "order": 7
    },
    {
      "id": "map",
      "enabled": true,
      "order": 8
    }
  ],
  "assetPaths": [],
  "factualClaims": [
    {
      "path": "copy.hero.eyebrow",
      "evidenceRefs": [
        "facts.map[0]"
      ]
    },
    {
      "path": "copy.hero.subtitle",
      "evidenceRefs": [
        "facts.description[0]"
      ]
    },
    {
      "path": "copy.about.body",
      "evidenceRefs": [
        "facts.description[0]"
      ]
    },
    {
      "path": "copy.reviews",
      "evidenceRefs": [
        "facts.googleReviews[0]"
      ]
    },
    {
      "path": "copy.contact.body",
      "evidenceRefs": [
        "facts.map[0]"
      ]
    }
  ],
  "warnings": [
    "Conteúdo limitado aos dados comerciais confirmados na fonte original."
  ],
  "createdAt": "2026-08-13T04:49:30Z"
}
