{
  "schemaVersion": 1,
  "studioId": "estudio-kilombo-vespasiano-6cdbbf",
  "generationId": "gen-0df74a6a44ce2b70fdda",
  "inputHash": "0df74a6a44ce2b70fdda0087830d55e3af6ce3eaca63829c8df956d191bbe93f",
  "provider": "deterministic-source",
  "model": "source-batch-v1",
  "promptVersion": "batch.v1",
  "templateId": "bold",
  "branding": {
    "colors": {
      "background": "#08080a",
      "surface": "#18181d",
      "primary": "#d7ff3f",
      "secondary": "#9a8cff",
      "text": "#f8f8f2",
      "mutedText": "#a4a4ad"
    },
    "fontHeading": "Archivo_Black",
    "fontBody": "Outfit",
    "radius": "large",
    "mood": [
      "enérgico",
      "direto"
    ],
    "imageTreatment": "Sem mídia não verificada; composição tipográfica e cromática."
  },
  "copy": {
    "hero": {
      "eyebrow": "Vespasiano — Minas Gerais",
      "title": "Estúdio Kilombo",
      "subtitle": "Um endereço para música em Vespasiano. Consulte disponibilidade e detalhes diretamente com o estúdio.",
      "primaryCta": "Falar com o estúdio"
    },
    "about": {
      "title": "O estúdio",
      "body": "Estúdio Kilombo é um estúdio musical localizado em Vespasiano, Minas Gerais."
    },
    "reviews": {
      "title": "Avaliações",
      "rating": 4.9,
      "count": 27
    },
    "contact": {
      "title": "Vamos conversar?",
      "body": "R. A G, 78 - Vista Alegre, Vespasiano - MG, 33200-000, Brazil",
      "cta": "Chamar no WhatsApp"
    }
  },
  "sections": [
    {
      "id": "hero",
      "enabled": true,
      "order": 0
    },
    {
      "id": "about",
      "enabled": true,
      "order": 1
    },
    {
      "id": "gallery",
      "enabled": false,
      "order": 2
    },
    {
      "id": "equipment",
      "enabled": false,
      "order": 3
    },
    {
      "id": "pricing",
      "enabled": false,
      "order": 4
    },
    {
      "id": "hours",
      "enabled": false,
      "order": 5
    },
    {
      "id": "reviews",
      "enabled": true,
      "order": 6
    },
    {
      "id": "contact",
      "enabled": true,
      "order": 7
    },
    {
      "id": "map",
      "enabled": true,
      "order": 8
    }
  ],
  "assetPaths": [],
  "factualClaims": [
    {
      "path": "copy.hero.eyebrow",
      "evidenceRefs": [
        "facts.map[0]"
      ]
    },
    {
      "path": "copy.hero.subtitle",
      "evidenceRefs": [
        "facts.description[0]"
      ]
    },
    {
      "path": "copy.about.body",
      "evidenceRefs": [
        "facts.description[0]"
      ]
    },
    {
      "path": "copy.reviews",
      "evidenceRefs": [
        "facts.googleReviews[0]"
      ]
    },
    {
      "path": "copy.contact.body",
      "evidenceRefs": [
        "facts.map[0]"
      ]
    }
  ],
  "warnings": [
    "Conteúdo limitado aos dados comerciais confirmados na fonte original."
  ],
  "createdAt": "2026-08-13T04:49:30Z"
}
